{"$schema":"https://json-schema.org/draft/2020-12/schema","$id":"https://schemas.event-driven-commerce.test/events/inventory-reserved-v1.schema.json","title":"InventoryReservedV1","type":"object","additionalProperties":false,"required":["eventId","eventType","eventVersion","aggregateId","correlationId","causationId","occurredAt","payload"],"properties":{"eventId":{"type":"string","format":"uuid"},"eventType":{"const":"InventoryReservedV1"},"eventVersion":{"const":1},"aggregateId":{"type":"string","format":"uuid"},"correlationId":{"type":"string","format":"uuid"},"causationId":{"type":"string","format":"uuid"},"occurredAt":{"type":"string","format":"date-time"},"payload":{"type":"object","additionalProperties":false,"required":["reservationId","orderId","items","reservedAt","expiresAt"],"properties":{"reservationId":{"type":"string","format":"uuid"},"orderId":{"type":"string","format":"uuid"},"items":{"type":"array","minItems":1,"items":{"type":"object","additionalProperties":false,"required":["sku","quantity"],"properties":{"sku":{"type":"string"},"quantity":{"type":"integer","minimum":1}}}},"reservedAt":{"type":"string","format":"date-time"},"expiresAt":{"type":"string","format":"date-time"}}}}}
