{"eventId":"71000000-0000-4000-8000-000000000001","eventType":"InventoryReservedV1","eventVersion":1,"aggregateId":"72000000-0000-4000-8000-000000000001","correlationId":"73000000-0000-4000-8000-000000000001","causationId":"74000000-0000-4000-8000-000000000001","occurredAt":"2026-08-11T12:00:00Z","payload":{"reservationId":"75000000-0000-4000-8000-000000000001","orderId":"72000000-0000-4000-8000-000000000001","items":[{"sku":"SKU-001","quantity":2}],"reservedAt":"2026-08-11T12:00:00Z","expiresAt":"2026-08-11T12:30:00Z"}}
